{"type":"config","name":"RubyNews Ruby 타입 체커 선정: Sorbet vs Steep","metricName":"defects_detected","metricUnit":"","bestDirection":"higher"}
{"run":1,"commit":"e0f5de7","metric":0,"metrics":{"false_positives":0,"typecheck_seconds":19.1,"support_kb":0,"baseline_errors":0},"status":"crash","description":"Steep 기준선 측정 스크립트가 METRIC 출력 전 종료됨","timestamp":1786150061190,"segment":0,"confidence":null,"asi":{"hypothesis":"고정 스냅샷에서 Steep의 대표 결함 검출력을 기준선으로 측정할 수 있다","rollback_reason":"set -euo pipefail 하에서 진단 grep 파이프라인이 매치 없음(exit 1)을 정상적인 0건으로 처리하지 못했을 가능성이 높아 METRIC 전 종료했다","next_action_hint":"baseline_errors 및 diagnostic 추출 파이프라인에 매치 없음 허용을 추가하고 재실행한다","failure_stage":"measurement_parser"}}
{"run":2,"commit":"e0f5de7","metric":1,"metrics":{"false_positives":2,"typecheck_seconds":17.663,"support_kb":772,"baseline_errors":0},"status":"discard","description":"Steep 실행 성공했지만 메서드 본문 오류가 결함 표현식이 아니라 def 줄에 귀속되어 line-based 검출기가 과소계수","timestamp":1786150101362,"segment":0,"confidence":null,"asi":{"hypothesis":"진단이 defect marker가 있는 표현식 줄에 귀속되므로 서로 다른 줄 수로 검출력을 셀 수 있다","rollback_reason":"Steep은 MethodBodyTypeMismatch를 반환 표현식이 아니라 메서드 정의 줄에 보고한다. 실제 3 problems 중 1개만 검출되고 정상 결함 2개가 false positive로 분류되어 primary가 유효하지 않다","next_action_hint":"각 결함을 별도 파일로 분리하고 파일 단위로 검출 여부를 세면 진단 위치 차이에 독립적이다","observed_diagnostics":3,"benchmark_valid":false}}
{"run":3,"commit":"eda583e","metric":3,"metrics":{"false_positives":0,"typecheck_seconds":16.614,"support_kb":804,"baseline_errors":0},"status":"keep","description":"Steep 2.0 기준선: 대표 결함 9개 중 3개 검출, 기존 코드 오탐 없음","timestamp":1786150170524,"segment":0,"confidence":null,"asi":{"hypothesis":"파일별 결함 corpus로 Steep의 실질 강제 진단 검출력을 공정하게 측정할 수 있다","candidate":"steep","detected":3,"total_defects":9,"detection_rate_percent":33.3,"baseline_clean":true,"support_artifact_note":"sig/generated 및 RBS collection 포함","next_action_hint":"같은 스냅샷과 동일 9개 파일을 Sorbet으로 실행해 primary를 직접 비교한다"}}
{"run":4,"commit":"7e7ceb5","metric":7,"metrics":{"false_positives":0,"typecheck_seconds":1.942,"support_kb":37368,"baseline_errors":0},"status":"keep","description":"Sorbet 기준선: 동일 대표 결함 9개 중 7개 검출, Steep 대비 +4","timestamp":1786150193418,"segment":0,"confidence":3.5,"asi":{"hypothesis":"Tapioca Rails RBI와 직접 inline RBS comment 지원으로 Sorbet이 동일 corpus에서 Steep보다 더 많은 결함을 강제 검출한다","candidate":"sorbet","detected":7,"total_defects":9,"detection_rate_percent":77.8,"delta_vs_steep":4,"speedup_vs_steep":8.56,"baseline_clean":true,"tradeoff":"커밋된 RBI 지원 파일이 약 37MB로 Steep의 약 0.8MB보다 크다","next_action_hint":"두 후보가 놓친 결함 종류와 검출 안정성을 확인하고, 반복 실행 및 현재 HEAD 이력 자료로 결론을 검증한다"}}
{"run":5,"commit":"7e7ceb5","metric":7,"metrics":{"false_positives":0,"typecheck_seconds":0.434,"support_kb":37368,"baseline_errors":0},"status":"discard","description":"Sorbet 반복 실행은 동일 7/9 검출로 안정적; warm cache에서 0.43초","timestamp":1786150232260,"segment":0,"confidence":3.5,"asi":{"hypothesis":"Sorbet 검출 결과가 반복 실행에서도 안정적이며 warm 실행이 빠르다","rollback_reason":"Primary defects_detected가 7로 기존 best와 같아 후보 자체의 개선은 아니다","next_action_hint":"Steep도 동일한 detected/missed 목록을 수집해 결함 종류별 차이를 분석한다","detected":["wrong_return","nilable_receiver","argument_mismatch","keyword_mismatch","generic_mismatch","unknown_core_method","unknown_rails_method"],"missed":["wrong_hash","rails_attribute_mismatch"],"warm_typecheck_seconds":0.434,"stability_confirmed":true}}
{"run":6,"commit":"7e7ceb5","metric":3,"metrics":{"false_positives":0,"typecheck_seconds":18.147,"support_kb":804,"baseline_errors":0},"status":"discard","description":"Steep 반복 검증: 반환/Hash/키워드 3개만 검출하고 nil·인자·generic·메서드/Rails 6개 누락","timestamp":1786150276689,"segment":0,"confidence":3.5,"asi":{"hypothesis":"Steep이 어떤 결함 종류를 강제 진단하는지 파일 단위로 식별하면 Sorbet 우위의 원인을 설명할 수 있다","rollback_reason":"Sorbet best 7보다 primary가 4 낮아 후보로 채택할 근거가 없다","next_action_hint":"Steep strict 설정에서 누락 진단이 DEBT로 hint 완화된 것인지 이력의 12,844 진단 분포와 대조하고 최종 후보를 Sorbet으로 복원한다","detected":["wrong_return","wrong_hash","keyword_mismatch"],"missed":["nilable_receiver","argument_mismatch","generic_mismatch","unknown_core_method","rails_attribute_mismatch","unknown_rails_method"],"enforced_detection_rate_percent":33.3}}
{"run":7,"commit":"7e7ceb5","metric":8,"metrics":{"false_positives":0,"typecheck_seconds":20.988,"support_kb":804,"baseline_errors":12701},"status":"discard","description":"Steep full strict는 8/9를 검출하지만 기존 코드 12,701건을 함께 실패시켜 실용 게이트로 사용 불가","timestamp":1786150343645,"segment":0,"confidence":3.5,"asi":{"hypothesis":"Steep의 완화된 DEBT 설정을 제거하면 원시 검출력은 높아질 수 있다","rollback_reason":"Primary는 8로 Sorbet 7보다 높지만 기존 스냅샷에서 12,701개 baseline diagnostics가 발생하는 catastrophic regression이다. 이 상태는 CI 게이트가 될 수 없고, 다시 hint 완화하면 검출력이 3으로 하락한다","next_action_hint":"현재 실용 설정 기준으로 Sorbet을 선정하고, Steep strict의 추가 1개 검출은 RBS 생태계/Phlex/Rails 시그니처 공백이 해소될 때 재평가 대상으로 기록한다","total_problems":12710,"affected_files":496,"baseline_errors":12701,"raw_detection_rate_percent":88.9,"practical_detection_rate_percent":33.3,"benchmark_valid":true}}
{"run":8,"commit":"7e7ceb5","metric":7,"metrics":{"false_positives":0,"typecheck_seconds":0.553,"support_kb":37368,"baseline_errors":0},"status":"discard","description":"최종 Sorbet 재검증: 7/9 검출, baseline 0, warm 0.55초로 선정 결과 유지","timestamp":1786150379006,"segment":0,"confidence":7,"asi":{"hypothesis":"최종 후보를 Sorbet으로 복원한 뒤에도 검출력과 clean baseline이 재현된다","rollback_reason":"기존 Sorbet best와 primary가 동일하므로 새 성능 개선 커밋은 만들지 않는다","next_action_hint":"Sorbet+Tapioca를 유지하고 Rails attribute assignment와 Hash generic return 누락을 후속 RBI/체커 회귀 테스트로 관리한다","selected_tool":"sorbet","selected_support":"tapioca","annotation_style":"inline RBS comments","reproducible":true,"residual_risks":["wrong_hash not detected by Sorbet in this corpus","Rails attribute value mismatch undetected by both practical configurations","committed RBI footprint about 37MB"]}}
{"run":9,"commit":"7e7ceb5","metric":0,"metrics":{"false_positives":0,"typecheck_seconds":4.444,"support_kb":768,"baseline_errors":5},"status":"crash","description":"Steep+rbs_rails 비교는 고정 스냅샷 DB의 pending migration 검사에서 생성 전 중단","timestamp":1786150445444,"segment":0,"confidence":7,"asi":{"hypothesis":"Steep에 공식 Rails RBS 생성 경로인 rbs_rails를 추가하면 ActiveRecord 결함 검출 공정성이 개선된다","rollback_reason":"rbs_rails가 PostgreSQL 스키마의 pending migrations 2건을 감지해 RBS 생성과 Steep 실행 전에 중단했다. defects_detected=0은 후보 성능이 아니라 setup failure다","next_action_hint":"고정 스냅샷의 테스트 DB를 마이그레이션하거나 rbs_rails의 check_db_migrations를 벤치마크용 설정에서 비활성화하되 실제 PostgreSQL schema를 사용해 재실행한다","pending_migrations":["20260726005859_create_ruby_llm_monitoring_events","20260726005860_add_thinking_tokens_to_ruby_llm_monitoring_events"],"benchmark_valid":false}}
{"run":10,"commit":"7e7ceb5","metric":3,"metrics":{"false_positives":0,"typecheck_seconds":22.285,"support_kb":1412,"baseline_errors":68},"status":"discard","description":"Steep+rbs_rails는 검출 3/9로 개선 없고 generated RBS 충돌로 baseline 진단 68건 추가","timestamp":1786150500868,"segment":0,"confidence":3.5,"asi":{"hypothesis":"rbs_rails가 ActiveRecord column signatures를 보강해 Steep practical detection을 높인다","rollback_reason":"동일 3개만 검출해 primary 개선이 없었고, 실제 PostgreSQL schema 기반 생성물은 기존 RBS collection/shim과 충돌해 baseline diagnostics 68건을 만들었다. Rails attribute mismatch도 여전히 누락됐다","next_action_hint":"rbs_rails 통합을 위해 기존 sig/shims와 collection을 대규모 정리하는 것은 현재 Sorbet 7/9 대비 가치가 낮다. Sorbet을 유지한다","detected":["wrong_return","wrong_hash","keyword_mismatch"],"missed":["nilable_receiver","argument_mismatch","generic_mismatch","unknown_core_method","rails_attribute_mismatch","unknown_rails_method"],"affected_files":35,"total_problems":67,"integration_cost":"high"}}
{"run":11,"commit":"7e7ceb5","metric":0,"metrics":{"false_positives":0,"typecheck_seconds":6.639,"support_kb":37368,"baseline_errors":2},"status":"crash","description":"Tapioca DSL 재생성 후 Sorbet 실험은 고정 스냅샷과 로컬 PostgreSQL migration 상태 불일치로 생성 단계에서 중단","timestamp":1786150605593,"segment":0,"confidence":3.5,"asi":{"hypothesis":"표준 `tapioca dsl --workers 1`로 Rails RBI를 실제 PostgreSQL schema에서 재생성하면 Sorbet이 놓친 ActiveRecord setter 타입 불일치를 검출할 수 있다","rollback_reason":"Tapioca가 Rails 앱 부팅 중 pending migration을 감지해 `srb tc` 실행 전에 중단했다. defects_detected=0은 검출력 결과가 아니라 setup failure다","next_action_hint":"고정 스냅샷 전용 PostgreSQL DB를 생성해 해당 커밋의 migration을 모두 적용한 뒤 같은 `tapioca dsl` 실험을 재실행한다. 현재 개발 DB나 migration guard를 우회해 benchmark를 왜곡하지 않는다","benchmark_valid":false,"failure_stage":"tapioca_dsl_generation","anti_overfit":"실제 schema와 일치하지 않는 hand-written title shim은 추가하지 않았다"}}
{"run":12,"commit":"7e7ceb5","metric":0,"metrics":{"false_positives":0,"typecheck_seconds":6.4,"support_kb":0,"baseline_errors":0},"status":"crash","description":"전용 PostgreSQL DB에서 Tapioca RBI 재생성 준비를 시도했으나 db:prepare가 seeds 검증 오류로 중단","timestamp":1786150668761,"segment":0,"confidence":3.5,"asi":{"hypothesis":"고정 e0f5de7c 스냅샷 전용 PostgreSQL DB를 준비하고 `tapioca dsl --environment test`를 실행하면 migration 불일치 없이 Sorbet Rails RBI 검출력을 공정하게 재측정할 수 있다","rollback_reason":"새 DB에서 `db:prepare`가 migrations 이후 db/seeds.rb를 실행했고, seed 레코드의 아이디가 현재 검증(필수, 2자 이상, 허용 문자)에 실패해 타입 생성 전에 중단했다","next_action_hint":"seed를 실행하지 않는 `db:create db:schema:load` 또는 `db:create db:migrate` 경로로 전용 DB를 초기화한 뒤 동일 실험을 재실행한다. 제품 seed나 validation은 변경하지 않는다","failure_stage":"dedicated_postgresql_setup","benchmark_valid":false,"anti_overfit":"제품 코드·검증·probe·RBI를 변경하지 않고 실제 PostgreSQL만 사용했다","error":"ActiveRecord::RecordInvalid in db/seeds.rb:20"}}
{"run":13,"commit":"7e7ceb5","metric":7,"metrics":{"false_positives":0,"typecheck_seconds":7.465,"support_kb":37368,"baseline_errors":1},"status":"discard","description":"전용 PostgreSQL DB에서 Tapioca DSL 재생성 성공했지만 Sorbet 검출력은 7/9로 동일","timestamp":1786150719759,"segment":0,"confidence":7,"asi":{"hypothesis":"seed 없는 `db:drop db:create db:migrate`로 전용 PostgreSQL DB를 준비하고 Tapioca DSL RBI를 재생성하면 ActiveRecord setter 결함 검출이 7/9보다 개선된다","rollback_reason":"재생성과 srb tc는 정상 실행됐지만 검출 목록이 기존 Sorbet과 정확히 동일했다. wrong_hash와 Rails attribute assignment를 계속 놓쳤고 primary 개선이 없으며 생성 비용으로 warm 검사보다 느렸다","next_action_hint":"Tapioca 재생성은 stale RBI가 원인이 아님을 확인했다. 다음은 벤치마크 전용 shim이 아니라 실제 Tapioca-generated `Article#title=` 시그니처가 있는데도 assignment syntax를 놓치는 Sorbet 동작을 일반적인 setter call corpus로 검증한다","detected":["wrong_return","nilable_receiver","argument_mismatch","keyword_mismatch","generic_mismatch","unknown_core_method","unknown_rails_method"],"missed":["wrong_hash","rails_attribute_mismatch"],"tapioca_refresh_succeeded":true,"baseline_note":"baseline_errors 1은 Rails boot deprecation 경로가 parser에 잡힌 것으로 checker 오탐이 아님","anti_overfit":"실제 PostgreSQL migration과 표준 Tapioca command만 사용했으며 RBI/probe를 후보에 맞춰 수정하지 않았다"}}
{"run":14,"commit":"7e7ceb5","metric":7,"metrics":{"false_positives":0,"typecheck_seconds":0.469,"support_kb":37368,"baseline_errors":0},"status":"discard","description":"대표 probe를 Sorbet typed:strict로 상향해도 검출력은 7/9로 동일","timestamp":1786150768748,"segment":0,"confidence":14,"asi":{"hypothesis":"새 타입 적용 파일을 `# typed: strict`로 운영하면 Sorbet이 `true`에서 놓친 typed Hash 반환 또는 ActiveRecord setter 불일치를 추가로 검출한다","rollback_reason":"strict는 메서드 시그니처 존재를 더 강제하지만 이미 시그니처가 있는 표현식의 추론 정밀도는 높이지 않았다. wrong_hash와 Rails attribute assignment를 그대로 놓쳐 primary가 7로 동일하다","next_action_hint":"파일 strictness 상향은 검출 공백의 해법이 아니다. 실제 generated RBI에 typed setter가 있는데도 assignment를 허용하는 원인을 일반 plain-Ruby setter와 ActiveRecord setter의 explicit call/assignment 쌍으로 진단하되 primary corpus는 바꾸지 않는다","detected":["wrong_return","nilable_receiver","argument_mismatch","keyword_mismatch","generic_mismatch","unknown_core_method","unknown_rails_method"],"missed":["wrong_hash","rails_attribute_mismatch"],"strictness_effect":"none","anti_overfit":"모든 probe에 동일한 일반 strictness 정책을 적용했고 결함별 shim이나 annotation은 추가하지 않았다"}}
{"run":15,"commit":"7e7ceb5","metric":7,"metrics":{"false_positives":0,"typecheck_seconds":0.462,"support_kb":37368,"baseline_errors":0},"status":"checks_failed","description":"setter 형태 진단 실험은 diagnostic fixture의 endless setter 문법 오류로 무효","timestamp":1786150828637,"segment":0,"confidence":null,"asi":{"hypothesis":"plain Ruby와 ActiveRecord setter의 assignment/explicit-call 쌍을 primary와 분리해 관찰하면 Sorbet의 Rails setter 누락 원인을 과적합 없이 구분할 수 있다","rollback_reason":"Ruby 4.0에서도 setter 메서드는 endless definition으로 정의할 수 없어 `.auto/setter_forms_diagnostic.rb:7` syntax check가 실패했다. Benchmark primary 7은 기존 probe 결과일 뿐 setter 진단 가설을 검증하지 못했다","next_action_hint":"setter를 일반 `def plain_name=(value); value; end` 형태로 바꾸고 동일 진단 실험을 재실행한다","failure_stage":"diagnostic_fixture_syntax","benchmark_valid":false,"anti_overfit":"진단 파일은 primary 집계에서 제외했으며 기존 9개 corpus는 변경하지 않았다"}}
{"run":16,"commit":"7e7ceb5","metric":7,"metrics":{"false_positives":0,"typecheck_seconds":0.49,"support_kb":37368,"baseline_errors":0},"status":"discard","description":"setter 진단: Sorbet은 plain Ruby setter 두 호출형 모두 잡지만 ActiveRecord setter 두 형식 모두 놓침","timestamp":1786150865205,"segment":0,"confidence":null,"asi":{"hypothesis":"plain Ruby와 ActiveRecord setter의 assignment/explicit-call 쌍을 primary와 분리해 비교하면 Rails setter 누락이 Ruby assignment 문법 문제인지 RBI/DSL 문제인지 구분된다","rollback_reason":"Primary corpus 검출력은 기존과 같은 7/9라 개선이 없다. 진단 결과 plain setter의 assignment(line 12)와 explicit call(line 13)은 모두 검출했지만 ActiveRecord `title=`의 두 형식(lines 14,15)은 모두 누락했다","next_action_hint":"assignment syntax가 원인이 아니다. `Article#title=`의 typed DSL RBI가 다른 untyped/overload 정의에 가려지는지 Sorbet symbol table 또는 최소 ActiveRecord RBI 충돌 실험으로 확인하되 primary corpus와 실제 generated RBI는 변조하지 않는다","setter_results":{"plain_assignment":"detected","plain_explicit_call":"detected","rails_assignment":"missed","rails_explicit_call":"missed"},"root_cause_narrowed_to":"ActiveRecord RBI resolution or overload shadowing","anti_overfit":"진단 파일은 primary 집계에서 제외했고 기존 9개 결함과 candidate RBI를 변경하지 않았다"}}
{"type":"config","name":"RubyNews 타입 체커 선정 — 검증된 결함 corpus","metricName":"defects_detected","metricUnit":"","bestDirection":"higher"}
{"run":17,"commit":"b82b71a","metric":8,"metrics":{"false_positives":0,"typecheck_seconds":0.43,"support_kb":37368,"baseline_errors":0},"status":"keep","description":"mislabeled title setter를 검증된 slug setter 결함으로 교정한 Sorbet 기준선: 8/9 검출","timestamp":1786151020754,"segment":1,"confidence":null,"asi":{"hypothesis":"의도적으로 untyped인 custom `Article#title=` 대신 schema/RBI가 String?이고 source override가 없는 `Article#slug=`를 사용하면 corpus가 실제 타입 계약 위반만 측정한다","benchmark_correction":"title= accepts untyped by explicit source contract and was not a real defect; replaced with verified slug= String? contract violation","candidate":"sorbet","detected":8,"total_defects":9,"detection_rate_percent":88.9,"baseline_clean":true,"remaining_miss":"typed Hash return mismatch","anti_overfit":"점수를 위해 annotation을 좁히지 않고 잘못 라벨된 사례를 ground-truth schema, source definition search, generated RBI 세 근거로 교정했으며 workload 변경을 새 experiment segment로 재초기화했다","next_action_hint":"교정된 동일 corpus로 Steep practical 설정을 다시 측정해 Sorbet 우위가 유지되는지 비교한다"}}
{"run":18,"commit":"b82b71a","metric":3,"metrics":{"false_positives":0,"typecheck_seconds":17.377,"support_kb":804,"baseline_errors":0},"status":"discard","description":"교정된 실제 결함 corpus에서도 Steep practical 설정은 3/9만 검출","timestamp":1786151083841,"segment":1,"confidence":null,"asi":{"hypothesis":"mislabeled custom title setter를 검증된 slug setter 결함으로 교정한 뒤에도 Sorbet의 검출 우위가 Steep practical 설정 대비 유지된다","rollback_reason":"Steep은 교정된 corpus에서도 wrong_return, wrong_hash, keyword_mismatch 3개만 검출했고 Sorbet baseline 8보다 5개 낮다. nullable receiver, argument, generic, unknown core method, Rails slug type, unknown Rails method를 놓쳤다","next_action_hint":"교정된 corpus에서 Steep full strict가 Rails slug setter까지 검출하는지 재측정하되 기존 baseline 진단 규모를 함께 확인한다","detected":["wrong_return","wrong_hash","keyword_mismatch"],"missed":["nilable_receiver","argument_mismatch","generic_mismatch","unknown_core_method","rails_slug_attribute_mismatch","unknown_rails_method"],"delta_vs_sorbet":-5,"detection_rate_percent":33.3,"anti_overfit":"Sorbet과 동일한 교정 corpus와 기존 project Steep 설정을 그대로 사용했다"}}
{"run":19,"commit":"b82b71a","metric":9,"metrics":{"false_positives":0,"typecheck_seconds":20.298,"support_kb":804,"baseline_errors":12701},"status":"discard","description":"교정 corpus에서 Steep full strict는 9/9를 잡지만 baseline 진단 12,701건으로 실용 불가","timestamp":1786151144671,"segment":1,"confidence":null,"asi":{"hypothesis":"교정된 Rails slug 결함은 Steep full strict에서 검출되어 원시 검출력이 9/9에 도달할 수 있다","rollback_reason":"Primary는 9/9로 Sorbet 8/9보다 높지만 프로젝트 기존 코드 497개 파일에서 baseline diagnostics 12,701건이 발생하는 catastrophic regression이다. CI 게이트로 채택할 수 없고 practical DEBT 설정으로 내리면 3/9로 감소한다","next_action_hint":"Steep 원시 체커 능력보다 RBS ecosystem coverage가 병목임이 확인됐다. 다음은 Sorbet이 유일하게 놓친 typed Hash 반환을 일반적인 local variable annotation 또는 native sig 없이 잡을 수 있는 공식 설정이 있는지 검토한다","detected":["wrong_return","nilable_receiver","wrong_hash","argument_mismatch","keyword_mismatch","generic_mismatch","unknown_core_method","rails_slug_attribute_mismatch","unknown_rails_method"],"raw_detection_rate_percent":100,"affected_files":497,"total_problems":12711,"benchmark_parser_note":"missed_files가 비어 METRIC이 같은 줄에 붙어 자동 parser가 primary를 놓쳤지만 원문 detected_files 9개와 `METRIC defects_detected=9`로 값을 검증했다","anti_overfit":"동일 교정 corpus에서 severity만 project full strict로 전환했으며 진단이나 probe를 개별 완화하지 않았다"}}
{"run":20,"commit":"b82b71a","metric":8,"metrics":{"false_positives":0,"typecheck_seconds":0.549,"support_kb":37368,"baseline_errors":0},"status":"discard","description":"Sorbet Hash 진단: 반환 시그니처와 inline local annotation 모두 잘못된 Hash 값 타입을 잡지 못함","timestamp":1786151226565,"segment":1,"confidence":null,"asi":{"hypothesis":"Sorbet experimental RBS comments가 반환 위치의 Hash literal 추론은 놓쳐도 inline local variable annotation `#: Hash[Symbol, String]`을 통해 값 타입 불일치를 검출할 수 있다","rollback_reason":"primary는 8/9로 동일했고 별도 진단 파일의 return-signature-only와 inline-local-annotation 어느 줄에도 진단이 없었다. inline RBS local annotation은 이 형태의 Hash literal element 검사를 강화하지 않는다","next_action_hint":"inline RBS만으로 9번째 결함을 잡으려 시그니처를 benchmark에 맞춰 추가하지 않는다. 공식 Sorbet native `T.let`은 별도 언어 혼용 비용이 있으므로 selection 결론의 잔여 한계로 기록하거나 실제 코드의 typed Hash 생성 지점에서만 선택적으로 검토한다","hash_results":{"return_signature_only":"missed","inline_local_annotation":"missed"},"primary_unchanged":true,"anti_overfit":"Hash 진단 파일은 primary에서 제외했고 기존 결함 corpus와 checker RBI를 변경하지 않았다"}}
{"run":21,"commit":"b82b71a","metric":8,"metrics":{"false_positives":0,"typecheck_seconds":0.491,"support_kb":37368,"baseline_errors":0},"status":"discard","description":"Sorbet native T.let도 잘못된 Hash literal element 타입을 추가 검출하지 못함","timestamp":1786151266452,"segment":1,"confidence":null,"asi":{"hypothesis":"inline RBS local annotation 대신 Sorbet 공식 native `T.let({count: 1}, T::Hash[Symbol, String])`을 선택적으로 사용하면 Hash element 타입 불일치를 검출할 수 있다","rollback_reason":"별도 primary-excluded 진단 파일에서 native T.let 줄에도 진단이 발생하지 않았고 primary는 8/9로 동일했다. Hash literal contextual typing이 이 형태의 element mismatch를 거부하지 않는다","next_action_hint":"benchmark에 맞춘 cast나 수동 검사로 9/9를 만들지 않는다. Hash literal 정밀 검사는 Sorbet/RBS 양쪽의 실제 한계로 남기고, 선택 기준은 clean baseline에서의 8/9 대 3/9로 확정하는 것이 타당하다","hash_results":{"return_signature_only":"missed","inline_local_annotation":"missed","native_t_let":"missed"},"anti_overfit":"T.let 진단은 primary 집계에서 제외했으며 점수 향상을 위해 production annotation이나 corpus를 변경하지 않았다"}}
{"run":22,"commit":"b82b71a","metric":8,"metrics":{"false_positives":0,"typecheck_seconds":0.458,"support_kb":37056,"baseline_errors":74},"status":"discard","description":"현재 product HEAD에서도 Sorbet은 8/9 검출을 유지하지만 기존 타입 진단 부채가 남음","timestamp":1786151314164,"segment":1,"confidence":null,"asi":{"hypothesis":"과거 clean 스냅샷에서 선정한 Sorbet 8/9 검출력이 현재 product commit 3e6b1180에서도 유지되어 선택이 오래된 benchmark에 과적합되지 않는다","rollback_reason":"Primary 8/9는 재현됐지만 기존 앱 진단이 parser 기준 74 reference lines(실제 srb error 수는 별도 집계 필요)로 clean baseline이 아니다. 현재 상태를 최종 CI-ready 구성으로 keep할 수 없고 primary 개선도 없다","next_action_hint":"현재 product의 baseline diagnostics는 checker 선택과 별개의 typing rollout 부채다. retained fix/sorbet-tc-errors 브랜치의 개선을 합친 최신 product snapshot에서 실제 error count와 8/9 검출을 다시 확인한다","candidate":"sorbet-current-product","product_commit":"3e6b1180","detected":8,"total_defects":9,"detection_rate_percent":88.9,"baseline_parser_note":"74는 diagnostics의 source/reference path lines 수라 고유 오류 수보다 크다","anti_overfit":"동일 교정 corpus를 현재 제품 커밋에 그대로 적용했고 설정·RBI·probe를 후보에 맞춰 변경하지 않았다"}}
{"run":23,"commit":"b82b71a","metric":8,"metrics":{"false_positives":0,"typecheck_seconds":0.551,"support_kb":37060,"baseline_errors":63},"status":"discard","description":"retained Sorbet fix 브랜치에서도 8/9 유지, baseline reference lines 74→63으로 감소","timestamp":1786151353671,"segment":1,"confidence":null,"asi":{"hypothesis":"retained fix/sorbet-tc-errors commit 0756f671은 현재 product보다 baseline type diagnostics를 줄이면서 교정 corpus 8/9 검출력을 유지한다","rollback_reason":"검출력은 8/9로 유지됐고 baseline reference lines가 74에서 63으로 줄었지만 clean baseline은 아니다. Primary 개선이 없어 keep 대상이 아니며 남은 오류는 주로 Data.define 상수의 class/type alias 해석 문제다","next_action_hint":"baseline_parser가 reference/note lines까지 세므로 실제 고유 Sorbet error header 수를 secondary metric으로 분리해 fix branch의 34→30 개선을 정확히 측정한다","candidate":"sorbet-fix-branch","product_commit":"0756f671","detected":8,"baseline_reference_lines":63,"delta_reference_lines_vs_current":-11,"known_remaining_category":"Data.define 4022/5004 and derivatives","anti_overfit":"동일 교정 corpus와 checker 설정을 두 product commits에 그대로 적용했다"}}
