{"run":24,"commit":"b82b71a","metric":8,"metrics":{"false_positives":0,"typecheck_seconds":0.514,"support_kb":37060,"baseline_errors":63,"checker_errors":30},"status":"discard","description":"fix 브랜치의 실제 Sorbet 오류 header를 분리 측정: 30건, probe 검출 8/9 유지","timestamp":1786151400419,"segment":1,"confidence":null,"asi":{"hypothesis":"Sorbet diagnostic note/reference lines를 제외하고 `https://srb.help/`가 있는 error header만 세면 retained fix branch의 실제 baseline 부채를 정확히 30건으로 측정할 수 있다","rollback_reason":"측정 개선으로 실제 checker_errors=30을 확인했지만 primary defects_detected는 8로 동일해 candidate 성능 개선은 아니다","next_action_hint":"남은 30건이 모두 Data.define 계열인지 error code별로 집계해 Sorbet 선택의 Ruby 4.0 Data limitation을 정량화한다. benchmark corpus나 product source를 맞춤 수정하지 않는다","candidate":"sorbet-fix-branch","checker_errors":30,"reference_lines":63,"measurement_improvement":"separated unique Sorbet error headers from notes","anti_overfit":"오류 집계만 정교화했고 checker 입력·severity·corpus는 변경하지 않았다"}}
{"run":25,"commit":"b82b71a","metric":8,"metrics":{"false_positives":0,"typecheck_seconds":0.513,"support_kb":37060,"baseline_errors":63,"checker_errors":30},"status":"discard","description":"fix 브랜치 잔여 Sorbet 30건의 error code 분포를 정량화","timestamp":1786151450872,"segment":1,"confidence":null,"asi":{"hypothesis":"retained fix branch의 실제 30개 오류를 error code별로 분해하면 남은 부채가 일반 Rails typing 문제가 아니라 Data.define 해석 한계에 집중됐는지 판단할 수 있다","rollback_reason":"측정 결과만 정교화됐고 primary는 8/9로 동일해 성능 개선은 아니다","next_action_hint":"분포는 4022=2, 5004=6, 파생 call/type 오류 7002=8, 7003=1, 7004=3, 7007=10이다. Data.define 지원 전략은 checker 선택과 분리해 upstream Sorbet 지원 또는 유지 가능한 공통 shim 방식으로 평가한다","error_code_counts":{"4022":2,"5004":6,"7002":8,"7003":1,"7004":3,"7007":10},"checker_errors":30,"interpretation":"4022/5004 Data.define constant-vs-class failures cascade into 700x type/call diagnostics","anti_overfit":"오류 출력 집계만 추가했고 severity, source, RBI, corpus를 변경하지 않았다"}}
{"run":26,"commit":"b82b71a","metric":8,"metrics":{"false_positives":0,"typecheck_seconds":2.268,"support_kb":37060,"baseline_errors":63,"checker_errors":30},"status":"discard","description":"Sorbet 0.6.13412→0.6.13416 업그레이드에도 Data.define 오류 30건과 8/9 검출 동일","timestamp":1786151520067,"segment":1,"confidence":null,"asi":{"hypothesis":"retained fix branch에서 Sorbet을 최신 0.6.13416으로 올리면 Ruby 4.0 Data.define constant/class 해석이 개선되어 checker_errors가 30보다 감소할 수 있다","rollback_reason":"0.6.13412에서 0.6.13416으로 실제 업데이트됐지만 checker_errors=30, code 분포, primary=8/9가 모두 동일했다. 검사 시간만 cold update/cache 영향으로 증가했다","next_action_hint":"단기 Sorbet 패치 업그레이드는 Data.define 해법이 아니다. generic shim은 과거 충돌 이력이 있으므로 upstream 지원을 기다리거나 Data 결과 타입을 checker-friendly한 명시 class로 설계하는 별도 migration 의사결정이 필요하다","sorbet_before":"0.6.13412","sorbet_after":"0.6.13416","checker_errors_before":30,"checker_errors_after":30,"anti_overfit":"표준 bundle update만 적용했고 source, RBI shim, severity, corpus는 변경하지 않았다"}}
{"run":27,"commit":"b82b71a","metric":8,"metrics":{"false_positives":0,"typecheck_seconds":0.647,"support_kb":37368,"baseline_errors":0,"checker_errors":0},"status":"discard","description":"Sorbet Hash 진단: typed empty accumulator 후 mutation은 잘못된 value 타입을 검출","timestamp":1786151570133,"segment":1,"confidence":null,"asi":{"hypothesis":"Sorbet이 완성된 Hash literal의 contextual element mismatch는 놓쳐도 `T.let({}, T::Hash[Symbol, String])`로 타입을 먼저 고정한 accumulator에 잘못된 값을 mutation하면 검출할 수 있다","rollback_reason":"별도 diagnostic line 24에서 Integer→String 불일치를 실제 검출했지만 primary corpus의 one-shot Hash return은 그대로여서 defects_detected는 8이다. Candidate 자체 개선이 아니라 coding-pattern 발견이다","next_action_hint":"실제 코드에서 점진적으로 조립하는 typed Hash에는 typed accumulator 패턴을 권장할 수 있다. 단순 return literal을 benchmark 점수 때문에 accumulator로 재작성하지 말고 가독성과 실제 위험이 정당화할 때만 적용한다","hash_results":{"return_signature_only":"missed","inline_local_annotation":"missed","native_t_let_literal":"missed","typed_accumulator_mutation":"detected"},"diagnostic_line":24,"anti_overfit":"진단은 primary에서 제외했고 production Hash 코드를 점수를 위해 재작성하지 않았다"}}
{"run":28,"commit":"b82b71a","metric":8,"metrics":{"false_positives":0,"typecheck_seconds":0.669,"support_kb":37368,"baseline_errors":0,"checker_errors":0},"status":"discard","description":"inline RBS typed accumulator도 Hash mutation 값 타입 불일치를 검출","timestamp":1786151611484,"segment":1,"confidence":null,"asi":{"hypothesis":"프로젝트 선호 스타일인 `value = {} #: Hash[Symbol, String]`으로 빈 accumulator 타입을 먼저 고정하면 native T.let 없이도 후속 잘못된 Hash mutation을 Sorbet이 검출한다","rollback_reason":"진단 line 31에서 inline RBS accumulator의 Integer→String mutation을 검출했지만 primary one-shot Hash literal은 그대로여서 defects_detected는 8이다. Checker 후보 성능 개선이 아니라 권장 가능한 코딩 패턴 발견이다","next_action_hint":"점진적 Hash 조립에는 프로젝트 규칙과 일치하는 inline RBS accumulator를 native T.let보다 우선할 수 있다. one-shot literal은 가독성을 희생해 바꾸지 않고 잔여 체커 한계로 둔다","hash_results":{"inline_rbs_accumulator_mutation":"detected","native_t_let_accumulator_mutation":"detected","one_shot_literal":"missed"},"diagnostic_lines":[24,31],"anti_overfit":"진단은 primary에서 제외했고 기존 corpus와 production 구현을 변경하지 않았다"}}
{"run":29,"commit":"b82b71a","metric":3,"metrics":{"false_positives":0,"typecheck_seconds":11.181,"support_kb":804,"baseline_errors":0,"checker_errors":0},"status":"discard","description":"Steep server warm check는 11.18초로 단축되지만 검출력은 3/9","timestamp":1786151678303,"segment":1,"confidence":null,"asi":{"hypothesis":"Steep 2.0 server가 RBS environment를 미리 로드하면 practical 설정의 반복 검사 지연을 크게 줄여 Sorbet과의 개발자 피드백 시간 격차를 완화한다","rollback_reason":"일반 Steep practical 17.377초에서 server-backed check 11.181초로 약 35.7% 단축됐지만 Sorbet warm 0.43초보다 약 26배 느리고 primary는 여전히 3/9다","next_action_hint":"Steep server는 보조적 속도 개선일 뿐 선택을 뒤집지 않는다. 최종 선정 근거에 warm server 결과를 포함하고 Sorbet을 유지한다","candidate":"steep-server","detection_rate_percent":33.3,"speedup_vs_steep_practical_percent":35.7,"slowdown_vs_sorbet_warm":26,"setup_note":"rbs-inline generation and server startup were primed before timed check","anti_overfit":"동일 corpus와 diagnostics 설정을 사용하고 서버 캐시만 표준 방식으로 활성화했다"}}
{"run":30,"commit":"b82b71a","metric":0,"metrics":{"false_positives":0,"typecheck_seconds":1.257,"support_kb":37368,"baseline_errors":0,"checker_errors":0},"status":"crash","description":"Sorbet CI 조합은 tapioca gem --verify가 rbs@4.1.2 RBI drift를 감지해 srb 실행 전 중단","timestamp":1786151723139,"segment":1,"confidence":null,"asi":{"hypothesis":"권장 CI 경로 `tapioca gem --verify && srb tc`가 고정 clean snapshot에서 RBI freshness와 8/9 검출을 함께 보장하며 낮은 운영 비용으로 통과한다","rollback_reason":"Tapioca verify가 `sorbet/rbi/gems/rbs@4.1.2.rbi`를 out-of-date로 판정해 srb tc 전에 중단했다. defects_detected=0은 checker 성능이 아니라 RBI reproducibility/integrity failure다","next_action_hint":"동일 버전 rbs RBI가 환경에 따라 달라지는 원인을 diff로 조사한다. 단순 재생성으로 benchmark를 통과시키기 전에 generator/Tapioca/Ruby 플랫폼 결정성을 확인한다","failure_stage":"tapioca_gem_verify","drift_file":"sorbet/rbi/gems/rbs@4.1.2.rbi","benchmark_valid":false,"operational_risk":"committed RBI drift can block CI even when Gemfile.lock version is unchanged","anti_overfit":"verify 실패를 우회하거나 generated RBI를 점수 때문에 덮어쓰지 않았다"}}
{"run":31,"commit":"b82b71a","metric":8,"metrics":{"false_positives":0,"typecheck_seconds":29.594,"support_kb":37368,"baseline_errors":2,"checker_errors":0},"status":"discard","description":"rbs gem RBI를 선행 생성하면 verify+Sorbet CI가 통과하지만 29.6초 소요, 파일 diff 없음","timestamp":1786151813429,"segment":1,"confidence":null,"asi":{"hypothesis":"verify가 지적한 rbs@4.1.2 RBI를 표준 `tapioca gem rbs --workers 1`로 재생성하면 실제 artifact drift가 고쳐지고 이후 verify+srb가 통과한다","rollback_reason":"전체 CI 경로는 통과하고 primary 8/9를 유지했지만 generated RBI의 git diff는 0줄이었다. 즉 artifact 내용 수정이 아니라 선행 generation이 process/cache 상태를 바꿔 verify false positive를 제거한 것으로 보이며, 29.594초 비용과 primary 무개선 때문에 keep하지 않는다","next_action_hint":"fresh process의 verify가 실패하고 generation 직후 verify가 diff 없이 통과하는 cache-dependent nondeterminism을 독립 process/cleared cache로 재현해 Tapioca 운영 위험으로 분리한다","rbi_diff_stat":"empty","verify_after_generation":"passed","checker_errors":0,"timing_seconds":29.594,"baseline_note":"2 reference lines are Rails boot deprecation warnings, not Sorbet errors","anti_overfit":"표준 Tapioca generation과 verify만 사용했고 generated file을 수동 수정하거나 verify를 우회하지 않았다"}}
{"run":32,"commit":"b82b71a","metric":0,"metrics":{"false_positives":0,"typecheck_seconds":2.06,"support_kb":37368,"baseline_errors":0,"checker_errors":0},"status":"crash","description":"Tapioca verify 단순 재시도도 rbs@4.1.2 RBI drift를 반복 보고해 CI 중단","timestamp":1786151862247,"segment":1,"confidence":null,"asi":{"hypothesis":"첫 `tapioca gem --verify`가 필요한 cache를 준비한다면 동일 fresh worktree에서 두 번째 verify는 generation 없이 통과할 수 있다","rollback_reason":"첫 verify status=1 뒤 두 번째 verify도 동일한 rbs@4.1.2.rbi drift로 실패했고 srb tc는 실행되지 않았다. 단순 process retry나 verify 자체의 cache warming으로 해결되지 않는다","next_action_hint":"이전 generation 후 diff 0인데 verify가 통과한 현상은 `tapioca gem rbs`가 파일 외 상태를 명시적으로 준비하기 때문이다. 생성 전후의 tmp/cache 파일 목록과 환경을 비교해 원인을 찾되 CI에서 무조건 재생성하는 workaround는 비용/결정성을 평가한 뒤 결정한다","first_verify_status":1,"second_verify_status":1,"drift_file":"sorbet/rbi/gems/rbs@4.1.2.rbi","benchmark_valid":false,"anti_overfit":"verify 실패를 무시해 srb 점수를 내지 않고 두 번째 verify도 필수 게이트로 유지했다"}}
{"run":33,"commit":"b82b71a","metric":8,"metrics":{"false_positives":0,"typecheck_seconds":28.211,"support_kb":37368,"baseline_errors":2,"checker_errors":0},"status":"discard","description":"Tapioca verify 원인 확인: rbs@4.1.2 RBI가 snapshot에 없고 generation이 새 파일을 생성","timestamp":1786151957005,"segment":1,"confidence":null,"asi":{"hypothesis":"generation 전후 SHA와 cache 파일 수를 측정하면 verify 실패가 artifact 내용 drift인지 파일 외 cache 상태인지 구분된다","rollback_reason":"before_sha가 비어 있고 generation 후 SHA가 ca9c233e...로 생겼다. 즉 snapshot에 rbs@4.1.2.rbi가 없었고 generation이 새 untracked 파일을 만들었다. 이전 `git diff --numstat`가 빈 것은 git diff가 untracked 파일을 보고하지 않기 때문이며 cache 비결정성 가설은 기각됐다. Primary는 8로 동일하다","next_action_hint":"Tapioca verify 오류는 정상적인 missing RBI freshness 검출이다. 상태 확인에는 `git status --porcelain`을 사용하고, 실제 프로젝트에서는 `tapioca gem rbs` 결과를 검토·커밋하면 된다","before_sha":null,"after_sha":"ca9c233e8ace7d87e28ca550c075dfe653e52cd4322e59c219fd74e1461f3c91","cache_files":4,"root_cause":"missing untracked generated RBI, not cache nondeterminism","measurement_correction":"git diff misses untracked files","anti_overfit":"표준 generation/verify를 유지했고 artifact를 수동 작성하거나 verify를 우회하지 않았다"}}
{"run":34,"commit":"b82b71a","metric":0,"metrics":{"false_positives":0,"typecheck_seconds":1.156,"support_kb":37056,"baseline_errors":0,"checker_errors":0},"status":"crash","description":"현재 product commit의 Sorbet CI는 13개 gem RBI freshness drift로 srb 전에 중단","timestamp":1786152007411,"segment":1,"confidence":null,"asi":{"hypothesis":"현재 product commit 3e6b1180에는 과거 missing rbs RBI 수정이 포함되어 있어 `tapioca gem --verify && srb tc` 전체 CI가 실행되고 8/9 검출을 재현한다","rollback_reason":"verify가 rubocop-sorbet RBI 1개 추가와 gem RBI 12개 변경을 요구해 srb 전에 중단했다. defects_detected=0은 checker 결과가 아니며 current product artifact freshness가 clean하지 않다","next_action_hint":"현재 branch의 Gemfile.lock과 generated gem RBIs를 표준 `tapioca gem --workers 1`로 동기화하고 git status --porcelain로 added/changed 파일을 검토하는 별도 maintenance 작업이 필요하다. 타입 체커 선택 결과와 혼동하지 않는다","failure_stage":"current_product_tapioca_verify","added_rbis":["rubocop-sorbet@0.14.0"],"changed_rbi_count":12,"benchmark_valid":false,"anti_overfit":"verify를 우회하지 않았고 stale RBI 상태에서 srb 점수를 산출하지 않았다"}}
{"run":35,"commit":"b82b71a","metric":8,"metrics":{"false_positives":0,"typecheck_seconds":34.366,"support_kb":37172,"baseline_errors":76,"checker_errors":34},"status":"discard","description":"현재 product RBI 25개 동기화 후 verify 통과, Sorbet 8/9 및 실제 오류 34건 확인","timestamp":1786152092382,"segment":1,"confidence":null,"asi":{"hypothesis":"현재 product commit에서 표준 `tapioca gem --workers 1`로 gem RBIs를 동기화하면 verify가 통과하고 stale artifacts와 독립적인 실제 Sorbet 상태를 측정할 수 있다","rollback_reason":"25개 RBI status 변경 후 verify와 srb가 정상 실행되고 primary 8/9를 유지했지만 checker_errors=34가 남았으며 primary 개선이 없다. Generated files는 isolated worktree에서만 생성해 keep하지 않는다","next_action_hint":"current product의 운영 준비에는 25개 generated RBI 검토/커밋과 retained fix branch 적용이 필요하다. fix branch가 checker_errors 34→30으로 줄인다는 비교가 확정됐다","candidate":"sorbet-current-ci-regenerated","generated_rbi_status_count":25,"verify":"passed","checker_errors":34,"error_code_counts":{"4022":2,"5004":6,"7002":5,"7003":11,"7004":3,"7007":7},"anti_overfit":"표준 Tapioca 전체 gem generation만 사용했고 generated content나 checker severity를 수동 수정하지 않았다"}}
{"run":36,"commit":"b82b71a","metric":8,"metrics":{"false_positives":0,"typecheck_seconds":35.089,"support_kb":37176,"baseline_errors":65,"checker_errors":30},"status":"discard","description":"fix branch + RBI 동기화 전체 CI: verify 통과, 8/9 검출, Sorbet 오류 30건","timestamp":1786152209471,"segment":1,"confidence":null,"asi":{"hypothesis":"retained fix branch 0756f671에 표준 gem RBI 동기화를 결합하면 verify가 통과하고 current product보다 적은 30개 오류로 가장 production-ready한 Sorbet 상태를 재현한다","rollback_reason":"25개 generated RBI status 변경 후 verify 통과, primary 8/9와 checker_errors=30을 재현했지만 clean baseline은 아니고 primary 개선도 없다. Isolated generated changes를 keep하지 않는다","next_action_hint":"실제 통합 순서는 generated RBI 동기화와 fix branch 변경을 함께 검토한 뒤 Data.define 30건 처리 정책을 결정하는 것이다. 타입체커 선정은 Sorbet으로 유지한다","candidate":"sorbet-fix-ci-regenerated","product_commit":"0756f671","generated_rbi_status_count":25,"verify":"passed","checker_errors":30,"delta_errors_vs_current_ci":-4,"anti_overfit":"표준 Tapioca generation만 사용했고 generated RBI, source, severity를 수동 조작하지 않았다"}}
{"run":37,"commit":"b82b71a","metric":8,"metrics":{"false_positives":0,"typecheck_seconds":7.753,"support_kb":37060,"baseline_errors":64,"checker_errors":30},"status":"discard","description":"fix branch에서 Tapioca DSL 재생성해도 Data.define 오류 30건 유지","timestamp":1786152272532,"segment":1,"confidence":null,"asi":{"hypothesis":"전용 PostgreSQL DB에서 표준 `tapioca dsl --environment test --workers 1`을 재실행하면 Data.define constants용 DSL RBI가 생성되어 fix branch의 30개 Sorbet 오류가 감소할 수 있다","rollback_reason":"DSL generation은 성공했지만 checker_errors=30과 error code 분포가 그대로였고 primary도 8/9로 동일했다. Tapioca 기본 DSL compilers는 이 프로젝트의 Data.define source-vs-class 해석 문제를 해결하지 않는다","next_action_hint":"자동 gem/DSL generation 경로는 모두 소진됐다. Data.define 해결은 custom Tapioca compiler/shim 또는 upstream Sorbet 지원의 별도 설계 문제이며, checker 선택 benchmark에서 맞춤 shim을 넣어 점수를 올리지 않는다","candidate":"sorbet-fix-dsl-refresh","tapioca_dsl":"succeeded","checker_errors_before":30,"checker_errors_after":30,"anti_overfit":"실제 PostgreSQL과 표준 전체 DSL generation만 사용했고 Data constants 전용 compiler나 shim은 추가하지 않았다"}}
{"run":38,"commit":"b82b71a","metric":8,"metrics":{"false_positives":0,"typecheck_seconds":0.481,"support_kb":37064,"baseline_errors":70,"checker_errors":34},"status":"discard","description":"historical Data.define shim 복원은 Sorbet 오류를 30→34로 악화","timestamp":1786152346802,"segment":1,"confidence":null,"asi":{"hypothesis":"이 프로젝트가 이전에 사용했던 `sorbet/rbi/shims/data_define.rbi`를 fix branch에 복원하면 Data constants를 class로 해석해 5004/파생 오류를 줄일 수 있다","rollback_reason":"5004 6건은 사라졌지만 source constant와 shim class 충돌 4022가 3건으로 늘고 7013 5건 및 7004 추가 오류가 생겨 checker_errors가 30에서 34로 악화됐다. Primary는 8/9로 동일하다","next_action_hint":"historical generic shim 삭제 결정이 타당함을 재확인했다. 동일 shim 복원이나 class 위장 방식은 폐기하고 upstream Data.define 지원을 기다린다","checker_errors_before":30,"checker_errors_after":34,"error_code_counts":{"4022":3,"7002":8,"7003":1,"7004":7,"7007":10,"7013":5},"regression":4,"anti_overfit":"과거 실제 프로젝트 shim을 그대로 복원했으며 benchmark 전용 정의를 새로 만들지 않았다"}}
